{"after_excerpt":{"locator":{"extraction_ref":"asset:sha256:92f625f02a9597f94a54b8d13d06c26702e1b795d6713f926f77ff27e3ba1716","joiner":"","kind":"PDF_TEXT_SPANS","output_sha256":"d416305d83f99e69362cf4f931a61696d05b2000860c3b56f987dafb932ef10c","raw_text_sha256":"535ae5e87d6f6003eca0f094ec111a7b09bf440b4fc210a2df223d9d9b1dfc63","schema_version":2,"spans":[{"end":669,"start":554,"unit_ref":"pdf:page:7"}]},"text":"親情使得娘家與出嫁女仍保持密切往\n來，稍有餘力的娘家會對生活貧困的女兒女婿予以接濟；反\n之，若娘家貧困，女兒亦千方百計進行救助－以女性為紐\n帶的姻親關係同樣是下層家庭的主要社會關係。另一方面，\n下層社會姻親之間的彼此救助頗具局限性","text_sha256":"535ae5e87d6f6003eca0f094ec111a7b09bf440b4fc210a2df223d9d9b1dfc63"},"before_sha256":"8eb1777f9f6b6e09e035846c38f03da8e798c668faccc01faed5398084b336d5","before_source":{"bibliography":{"citation":"毛立平，《清代下层妇女与娘家的关系——以南部县档案为中心的研究》，《近代中国妇女史研究》第21期，2013年6月","url":"https://www.mh.sinica.edu.tw/MHDocument/PublicationDetail/PublicationDetail_1533.pdf"},"carrier_capture":{"ref":"asset:sha256:ab0ec619b8b0ce0169a5e92d379950a93779e3d5db78878afc2f56989c3b381c","sha256":"ab0ec619b8b0ce0169a5e92d379950a93779e3d5db78878afc2f56989c3b381c"},"container":{"ref":"asset:sha256:6a296fa7157747efa8d4f61dba01279d23daea28d7dd284bc4c5a5993f007826","sha256":"6a296fa7157747efa8d4f61dba01279d23daea28d7dd284bc4c5a5993f007826"},"id":"src:research:mao-liping:2013:natal-family","locator":{"pages":"6-7","topic":"出嫁女与娘家往来及互助局限"},"locator_verification":{"reason":"EXCERPT_NOT_FOUND","status":"UNVERIFIED"},"notes":"二手研究且样本主要为四川下层妇女、年代多集中嘉道以后；只能软支持“娘家联系/有限援助渠道”，不能外推固定供养义务。","text":"親情使得娘家與出嫁女仍保持密切往來，稍有餘力的娘家會對生活貧困的女兒女婿予以接濟；反之，若娘家貧困，女兒亦千方百計進行救助。另一方面，下層社會姻親之間的彼此救助頗具局限性。","text_sha256":"4e098dfc89716c9b7ea1108c0a009db57fd68ab47029595c23fb3f8ae7a51efe","title":"毛立平《清代下层妇女与娘家的关系——以南部县档案为中心的研究》","type":"SECONDARY_RESEARCH","witness":{"annotation":"基于124件清代四川南部县衙门妇女案件","label":"毛立平论文","siglum":"MAO-2013-NANBU"}},"claim_reviews":[{"claim_id":"claim:history:h06:aid-is-limited","claim_sha256":"35233f4adb98c0ab801e5442d41e7e3ca4c20db00ffe7f1ba8eb733da42ea0e8","rationale":"连续原摘录仍明确“彼此救助颇具局限性”，与“稍有余力”等条件相互限定，支持资源约束的次级推论；摘录边界后还有具体论述，不擅补完整段落终止符。","result":"RETAIN_EXISTING_ASSERTION"},{"claim_id":"claim:history:h06:natal-family-ties","claim_sha256":"2b915d2f48601e54d98fe0f640ddd8259e194318e8661616d950fa1e5d06530a","rationale":"恢复中间论述后，娘家与出嫁女往来及有余力时接济仍在原刊中；保留SECONDARY及INFERENCE，研究对象为南部县下层家庭，不泛化为固定供养。","result":"RETAIN_EXISTING_ASSERTION"}],"impact":{"claims":[{"authority_scope":"HISTORICAL_FEASIBILITY","id":"claim:history:h06:aid-is-limited","kind":"HISTORICAL_MECHANISM","modality":"INFERENCE","statement":"同一研究同时显示姻亲互助受家庭资源限制，不能推出娘家固定、持续、足额供养的普遍规则。","status":"SUPPORTED","support":[{"relation":"SECONDARY","source":"src:research:mao-liping:2013:natal-family"}]},{"authority_scope":"HISTORICAL_FEASIBILITY","id":"claim:history:h06:natal-family-ties","kind":"HISTORICAL_MECHANISM","modality":"INFERENCE","statement":"基于南部县档案的研究表明，清代部分出嫁女婚后仍与娘家保持往来，危机时娘家可能提供资源或干预。","status":"SUPPORTED","support":[{"relation":"SECONDARY","source":"src:research:mao-liping:2013:natal-family"}]}],"decisions":[],"implementations":[],"title_axes":[]},"impact_sha256":"5d26bd370e520a874e87d4b8d55d5d5955310288d4281ee75b71229d06a93341","kind":"SOURCE_EXCERPT_CORRECTION","limitations":["此项为代理对本地数字录文及下游主张的复核，不冒充独立人工评审；逐字重取不等于馆藏原件或历史真实性鉴定。","保留原Source ID、type、witness、tier、bibliography和notes，以及全部Claim、Decision、Implementation与TitleAxis记录和权限。","保留PDF物理行换行；结束位置为明确截取边界，不是正文整段结束。研究结论仍为SECONDARY支持的INFERENCE。"],"omitted_line_breaks":[],"rationale":"采用原刊PDF物理第7页（印刷页9）的连续原始提取，恢复“以女性为纽带的姻亲关系同样是下层家庭的主要社会关系”中间论述，保留PDF换行，撤回擅加句号。本摘录结束于后一分句的“局限性”，不声称是完整段落；研究对象为南部县档案下层家庭，既有两个主张为有限、次级推论。","reviewer":{"kind":"AGENT_TEXT_REVIEW","name":"Codex"},"schema_version":1,"source_id":"src:research:mao-liping:2013:natal-family"}
